StockCode,Description
22941,CHRISTMAS LIGHTS 10 REINDEER
22943,CHRISTMAS LIGHTS 10 VINTAGE BAUBLES
22944,CHRISTMAS METAL POSTCARD WITH BELLS
22945,CHRISTMAS METAL TAGS ASSORTED
22946,WOODEN ADVENT CALENDAR CREAM
22947,WOODEN ADVENT CALENDAR RED
22949,36 DOILIES DOLLY GIRL
22950,36 DOILIES VINTAGE CHRISTMAS
22951,60 CAKE CASES DOLLY GIRL DESIGN
22952,60 CAKE CASES VINTAGE CHRISTMAS
22953,BIRTHDAY PARTY CORDON BARRIER TAPE
22955,36 FOIL STAR CAKE CASES
22956,36 FOIL HEART CAKE CASES
22957,SET 3 PAPER VINTAGE CHICK PAPER EGG
22959,WRAP CHRISTMAS VILLAGE
22960,JAM MAKING SET WITH JARS
22961,JAM MAKING SET PRINTED
22962,JAM JAR WITH PINK LID
22963,JAM JAR WITH GREEN LID
22964,3 PIECE SPACEBOY COOKIE CUTTER SET
22965,3 TRADITIONAl BISCUIT CUTTERS  SET
22966,GINGERBREAD MAN COOKIE CUTTER
22967,SET 3 SONG BIRD PAPER EGGS ASSORTED
22969,HOMEMADE JAM SCENTED CANDLES
22970,LONDON BUS COFFEE MUG
22971,QUEENS GUARD COFFEE MUG
22972,CHILDREN'S SPACEBOY MUG
22973,CHILDREN'S CIRCUS PARADE MUG
22974,CHILDRENS DOLLY GIRL MUG
22976,CIRCUS PARADE CHILDRENS EGG CUP
22977,DOLLY GIRL CHILDRENS EGG CUP
22978,PANTRY ROLLING PIN
22979,PANTRY WASHING UP BRUSH
22983,CARD BILLBOARD FONT
22984,CARD GINGHAM ROSE
22986,GINGHAM ROSE WRAP
22988,SOLDIERS EGG CUP
22989,SET 2 PANTRY DESIGN TEA TOWELS
22990,COTTON APRON PANTRY DESIGN
22993,SET OF 4 PANTRY JELLY MOULDS
22994,TRAVEL CARD WALLET RETROSPOT
22995,TRAVEL CARD WALLET SUKI
22996,TRAVEL CARD WALLET VINTAGE TICKET
22998,TRAVEL CARD WALLET KEEP CALM
23000,TRAVEL CARD WALLET TRANSPORT
23002,TRAVEL CARD WALLET SKULLS
23004,TRAVEL CARD WALLET PANTRY
23005,TRAVEL CARD WALLET I LOVE LONDON
23008,DOLLY GIRL BABY GIFT SET
23010,CIRCUS PARADE BABY GIFT SET
23029,DRAWER KNOB CRACKLE GLAZE GREEN
23031,DRAWER KNOB CRACKLE GLAZE PINK
23033,DRAWER KNOB CERAMIC RED
23034,DRAWER KNOB CERAMIC BLACK
23035,DRAWER KNOB CERAMIC IVORY
23042,PAPER LANTERN 7 POINT SNOW STAR
23047,PAPER LANTERN 5 POINT SEQUIN STAR
23049,RECYCLED ACAPULCO MAT RED
23051,RECYCLED ACAPULCO MAT BLUE
23052,RECYCLED ACAPULCO MAT TURQUOISE
23056,FLOWERS CHANDELIER T-LIGHT HOLDER
23060,HEART BEADED TRELLIS DECORATION
23067,HANGING ENGRAVED METAL HEART
23076,ICE CREAM SUNDAE LIP GLOSS
23078,ICE CREAM PEN LIP GLOSS
23079,TOADSTOOL BEDSIDE LIGHT
23083,SET 6 PAPER TABLE LANTERN STARS
23084,RABBIT NIGHT LIGHT
23085,ANTIQUE SILVER BAUBLE LAMP
23087,ZINC  HEART T-LIGHT HOLDER
23088,ZINC HEART FLOWER T-LIGHT HOLDER
23091,ZINC HERB GARDEN CONTAINER
23092,LARGE ANTIQUE WHITE PHOTO FRAME
23093,SMALL PARISIENNE HEART PHOTO FRAME
23096,PETIT TRAY CHIC
23100,SILVER BELLS TABLE DECORATION
23103,JINGLE BELL HEART DECORATION
23108,SET OF 10 LED DOLLY LIGHTS
23109,LED TEA LIGHTS
23113,PANTRY CHOPPING BOARD
23114,VINTAGE LEAF CHOPPING BOARD
23119,PACK OF 6 LARGE FRUIT STRAWS
23123,COCKTAIL SWORDS 50 PIECES
23126,FELTCRAFT GIRL AMELIE KIT
23127,FELTCRAFT GIRL NICOLE KIT
23129,HEART SHAPED HOLLY WREATH
23131,MISTLETOE HEART WREATH CREAM
23133,LARGE IVORY HEART WALL ORGANISER
23136,IVORY WIRE SWEETHEART LETTER TRAY
23144,ZINC T-LIGHT HOLDER STARS SMALL
23145,ZINC T-LIGHT HOLDER STAR LARGE
23146,TRIPLE HOOK ANTIQUE IVORY ROSE
23148,MINIATURE ANTIQUE ROSE HOOK IVORY
23150,IVORY SWEETHEART SOAP DISH
23153,ZINC SWEETHEART WIRE LETTER RACK
23154,SET OF 4 JAM JAR MAGNETS
23158,SET OF 5 LUCKY CAT MAGNETS
23159,SET OF 5 PANCAKE DAY MAGNETS
23160,REGENCY TEA SPOON
23162,REGENCY TEA STRAINER
23163,REGENCY SUGAR TONGS
23165,LARGE CERAMIC TOP STORAGE JAR
23167,SMALL CERAMIC TOP STORAGE JAR
23168,CLASSIC CAFE SUGAR DISPENSER
23169,CLASSIC GLASS COOKIE JAR
23170,REGENCY TEA PLATE ROSES
23171,REGENCY TEA PLATE GREEN
23172,REGENCY TEA PLATE PINK
23173,REGENCY TEAPOT ROSES
23174,REGENCY SUGAR BOWL GREEN
23175,REGENCY MILK JUG PINK
23176,ABC TREASURE BOOK BOX
23177,TREASURE ISLAND BOOK BOX
23182,TOILET SIGN OCCUPIED OR VACANT
23183,MOTHER'S KITCHEN SPOON REST
23184,BULL DOG BOTTLE OPENER
23185,FRENCH STYLE STORAGE JAR JAM
23188,VINTAGE  2 METER FOLDING RULER
23191,BUNDLE OF 3 RETRO NOTE BOOKS
23192,BUNDLE OF 3 ALPHABET EXERCISE BOOKS
23193,BUFFALO BILL TREASURE BOOK BOX
23196,VINTAGE LEAF MAGNETIC NOTEPAD
23197,SKETCHBOOK MAGNETIC SHOPPING LIST
23198,PANTRY MAGNETIC  SHOPPING LIST
23199,JUMBO BAG APPLES
23200,JUMBO BAG PEARS
23201,JUMBO BAG ALPHABET
23202,JUMBO BAG VINTAGE LEAF
23203,JUMBO BAG VINTAGE DOILY
23204,CHARLOTTE BAG APPLES DESIGN
23205,CHARLOTTE BAG VINTAGE ALPHABET
23206,LUNCH BAG APPLE DESIGN
23207,LUNCH BAG ALPHABET DESIGN
23208,LUNCH BAG VINTAGE LEAF DESIGN
23209,LUNCH BAG DOILEY PATTERN
23210,WHITE ROCKING HORSE HAND PAINTED
23215,JINGLE BELL HEART ANTIQUE SILVER
23219,LAUREL STAR ANTIQUE SILVER
23221,REINDEER HEART DECORATION SILVER
23225,CHERUB HEART DECORATION SILVER
23227,FILIGREE HEART BUTTERFLY WHITE
23229,VINTAGE DONKEY TAIL GAME
23231,WRAP DOILEY DESIGN
23232,WRAP VINTAGE LEAF DESIGN
23234,BISCUIT TIN VINTAGE CHRISTMAS
23235,STORAGE TIN VINTAGE LEAF
23236,DOILEY STORAGE TIN
23238,SET OF 4 KNICK KNACK TINS LONDON
23239,SET OF 4 KNICK KNACK TINS POPPIES
23240,SET OF 4 KNICK KNACK TINS DOILEY
23241,TREASURE TIN GYMKHANA DESIGN
23242,TREASURE TIN BUFFALO BILL
23243,SET OF TEA COFFEE SUGAR TINS PANTRY
23244,ROUND STORAGE TIN VINTAGE LEAF
23245,SET OF 3 REGENCY CAKE TINS
23247,BISCUIT TIN 50'S CHRISTMAS
23252,VINTAGE RED ENAMEL TRIM JUG
23254,CHILDRENS CUTLERY DOLLY GIRL
23255,CHILDRENS CUTLERY CIRCUS PARADE
23256,CHILDRENS CUTLERY SPACEBOY
23263,SET OF 3 WOODEN HEART DECORATIONS
23265,SET OF 3 WOODEN TREE DECORATIONS
23266,SET OF 3 WOODEN STOCKING DECORATION
23267,SET OF 4 SANTA PLACE SETTINGS
23270,SET OF 2 CERAMIC PAINTED HEARTS
23283,DOORMAT VINTAGE LEAVES DESIGN
23284,DOORMAT KEEP CALM AND COME IN
23286,BLUE VINTAGE SPOT BEAKER
23288,GREEN VINTAGE SPOT BEAKER
23289,DOLLY GIRL CHILDRENS BOWL
23290,SPACEBOY CHILDRENS BOWL
23291,DOLLY GIRL CHILDRENS CUP
23292,SPACEBOY CHILDRENS CUP
23293,SET OF 12 FAIRY CAKE BAKING CASES
23295,SET OF 12 MINI LOAF BAKING CASES
23296,SET OF 6 TEA TIME BAKING CASES
23297,SET 40 HEART SHAPE PETIT FOUR CASES
23298,SPOTTY BUNTING
23299,FOOD COVER WITH BEADS SET 2
23300,GARDENERS KNEELING PAD CUP OF TEA
23301,GARDENERS KNEELING PAD KEEP CALM
23307,SET OF 60 PANTRY DESIGN CAKE CASES
23308,SET OF 60 VINTAGE LEAF CAKE CASES
23309,SET OF 60 I LOVE LONDON CAKE CASES
23311,VINTAGE CHRISTMAS STOCKING
23314,VINTAGE CHRISTMAS TABLECLOTH
23316,RED REFECTORY CLOCK
23319,BOX OF 6 MINI 50'S CRACKERS
23320,GIANT 50'S CHRISTMAS CRACKER
23321,SMALL WHITE HEART OF WICKER
23322,LARGE WHITE HEART OF WICKER
23323,WHITE WICKER STAR
23325,RUSTIC STRAWBERRY JAM POT SMALL
23328,SET 6 SCHOOL MILK BOTTLES IN CRATE
23329,DECORATIVE WICKER HEART LARGE
23331,DECORATIVE WICKER HEART SMALL
23333,IVORY WICKER HEART MEDIUM
23342,MINT DINER WALL CLOCK
23343,JUMBO BAG VINTAGE CHRISTMAS
23344,JUMBO BAG 50'S CHRISTMAS
23346,SPACEBOY BEAKER
23347,I LOVE LONDON BEAKER
23348,CHILDRENS TOY COOKING UTENSIL SET
23349,ROLL WRAP VINTAGE CHRISTMAS
23350,ROLL WRAP VINTAGE SPOT
23351,ROLL WRAP 50'S CHRISTMAS
23354,6 GIFT TAGS 50'S CHRISTMAS
23355,HOT WATER BOTTLE KEEP CALM
23357,HOT WATER BOTTLE SEX BOMB
23358,HOT STUFF HOT WATER BOTTLE
23359,SET OF 12 T-LIGHTS VINTAGE DOILY
23365,SET 12 COLOUR PENCILS LOVE LONDON
23366,SET 12 COLOURING PENCILS DOILY
23367,SET 12 COLOUR PENCILS SPACEBOY
23371,SET 36 COLOUR PENCILS SPACEBOY
23376,PACK OF 12 VINTAGE CHRISTMAS TISSUE
23378,PACK OF 12 50'S CHRISTMAS TISSUES
23379,PACK OF 12 RED APPLE TISSUES
23380,PACK OF 12 VINTAGE DOILY TISSUES
23381,PACK OF 12 VINTAGE LEAF TISSUES
23382,BOX OF 6 CHRISTMAS CAKE DECORATIONS
23388,WOODLAND MINI BACKPACK
23389,SPACEBOY MINI BACKPACK
23390,DOLLY GIRL MINI BACKPACK
23392,SPACEBOY ROCKET LOLLY MAKERS
23393,HOME SWEET HOME CUSHION COVER
23394,POSTE FRANCE CUSHION COVER
23395,BELLE JARDINIERE CUSHION COVER
23396,LE JARDIN BOTANIQUE CUSHION COVER
23397,FOOT STOOL HOME SWEET HOME
23398,HANGING HEART BONHEUR
23399,HOME SWEET HOME HANGING HEART
23401,RUSTIC MIRROR WITH LACE HEART
23403,LETTER HOLDER HOME SWEET HOME
23405,HOME SWEET HOME 2 DRAWER CABINET
23407,SET OF 2 TRAYS HOME SWEET HOME
23408,PHOTO FRAME LINEN AND LACE SMALL
23411,TRELLIS COAT RACK
23412,HEART MIRROR ANTIQUE WHITE
23420,PANTRY HOOK TEA STRAINER
23426,METAL SIGN DROP YOUR PANTS
23427,STOOL HOME SWEET HOME
23432,PRETTY HANGING QUILTED HEARTS
23434,3 RAFFIA RIBBONS 50'S CHRISTMAS
23435,3 RAFFIA RIBBONS VINTAGE CHRISTMAS
23437,50'S CHRISTMAS GIFT BAG LARGE
23439,HAND WARMER RED LOVE HEART
23452,HEART MINI PORTRAIT FRAME
23461,SWEETHEART BIRD HOUSE
23462,ROCOCO WALL MIRROR WHITE
23469,CARD HOLDER LOVE BIRD SMALL
23480,MINI LIGHTS WOODLAND MUSHROOMS
23482,PEARLISED IVORY HEART LARGE
23485,BOTANICAL GARDENS WALL CLOCK
23487,SWEET HEART CAKE CARRIER
23489,VINTAGE BELLS GARLAND
23490,T-LIGHT HOLDER HANGING LOVE BIRD
23493,VINTAGE DOILY TRAVEL SEWING KIT
23494,VINTAGE DOILY DELUXE SEWING KIT
23495,SET OF 3 PANTRY WOODEN SPOONS
23497,CLASSIC CHROME BICYCLE BELL
23498,CLASSIC BICYCLE CLIPS
23501,KEY RING BASEBALL BOOT UNION JACK
23503,PLAYING CARDS KEEP CALM & CARRY ON
23506,MINI PLAYING CARDS SPACEBOY
23507,MINI PLAYING CARDS BUFFALO BILL
23508,MINI PLAYING CARDS DOLLY GIRL
23512,EMBROIDERED RIBBON REEL ROSIE
23513,EMBROIDERED RIBBON REEL SUSIE
23515,EMBROIDERED RIBBON REEL DAISY
23517,EMBROIDERED RIBBON REEL REBECCA
23525,WALL ART BUFFALO BILL
23526,WALL ART DOG LICENCE
23531,WALL ART BIG LOVE
23533,WALL ART GARDEN HAVEN
23534,STOP FOR TEA WALL ART
23543,WALL ART KEEP CALM
23550,WRAP ALPHABET POSTER
23551,PACK OF 12 PAISLEY PARK TISSUES
23552,BICYCLE PUNCTURE REPAIR KIT
23559,WOODLAND BUNNIES LOLLY MAKERS
23562,SET OF 6 RIBBONS PERFECTLY PRETTY
23566,EGG CUP MILKMAID HEIDI
23569,TRADTIONAL ALPHABET STAMP SET
23570,TRADITIONAL PICK UP STICKS GAME
23581,JUMBO BAG PAISLEY PARK
23583,LUNCH BAG PAISLEY PARK
23640,SET 10 CARDS SCOTTIE DOG 17211
23661,MILK MAIDS MUG
23681,LUNCH BAG RED VINTAGE DOILY
23694,PAISLEY PARK CARD
35095A,BLUE VICTORIAN FABRIC OVAL BOX
35095B,RED VICTORIAN FABRIC OVAL BOX
35443,RASTA IN BATH W SPLIFF ASHTRAY
35471D,SET OF 3 BIRD LIGHT PINK FEATHER
35599B,BLACK CHRISTMAS TREE 120CM
35648,VINTAGE BEAD PINK PURSE
35817P,"ACRYLIC JEWEL SNOWFLAKE,PINK"
35914,PINK CHICK EGG WARMER + EGG CUP
35915B,BLUE KNITTED HEN
35915C,PEACH KNITTED HEN
35916A,YELLOW FELT HANGING HEART W FLOWER
35924,HANGING FAIRY CAKE DECORATION
35953,FOLKART STAR CHRISTMAS DECORATIONS
35964,FOLKART CLIP ON STARS
35970,ZINC FOLKART SLEIGH BELLS
35971,ROSE FOLKART HEART DECORATIONS
37327,ASSTD MULTICOLOUR CIRCLES MUG
37340,MULTICOLOUR SPRING FLOWER MUG
37342,POLKADOT COFFEE CUP & SAUCER PINK
37444C,PINK BREAKFAST CUP AND SAUCER
37446,MINI CAKE STAND WITH HANGING CAKES
37447,CERAMIC CAKE DESIGN SPOTTED PLATE
37448,CERAMIC CAKE DESIGN SPOTTED MUG
37449,CERAMIC CAKE STAND + HANGING CAKES
37476,CONDIMENT TRAY 4 BOWLS AND 4 SPOONS
37482P,CUBIC MUG PINK POLKADOT
37489D,PINK/GREEN FLOWER DESIGN BIG MUG
40005B,BLUE ORGANDY ROUND LAMPSHADE W BEA
44092C,PURPLE/COPPER HANGING LAMPSHADE
46000M,POLYESTER FILLER PAD 45x45cm
46776F,WOVEN ROSE GARDEN CUSHION COVER
47420,ASSORTED COLOUR SUCTION CUP HOOK
47422,ASSORTED MONKEY SUCTION CUP HOOK
47481,50CM METAL STRING WITH  7 CLIPS
47503A,ASS FLORAL PRINT MULTI SCREWDRIVER
47504H,ENGLISH ROSE SPIRIT LEVEL
47504K,ENGLISH ROSE GARDEN SECATEURS
47559B,TEA TIME OVEN GLOVE
47566,PARTY BUNTING
47566B,TEA TIME PARTY BUNTING
47566b,TEA TIME PARTY BUNTING
47574A,ENGLISH ROSE SCENTED HANGING FLOWER
47585A,PINK FAIRY CAKE CUSHION COVER
47590A,BLUE HAPPY BIRTHDAY BUNTING
47590B,PINK HAPPY BIRTHDAY BUNTING
47591D,PINK FAIRY CAKE CHILDRENS APRON
47593B,SCOTTIE DOGS BABY BIB
47599A,PINK PARTY BAGS
48111,DOORMAT 3 SMILEY CATS
48116,DOORMAT MULTICOLOUR STRIPE
48129,DOORMAT TOPIARY
48138,DOORMAT UNION FLAG
48173C,DOORMAT BLACK FLOCK
48184,DOORMAT ENGLISH ROSE
48185,DOORMAT FAIRY CAKE
48187,DOORMAT NEW ENGLAND
48194,DOORMAT HEARTS
51014A,"FEATHER PEN,HOT PINK"
70007,HI TEC ALPINE HAND WARMER
71038,WHITE HANGING BEADS CANDLE HOLDER
71459,HANGING JAM JAR T-LIGHT HOLDERS
71477,COLOUR GLASS. STAR T-LIGHT HOLDER
72232,FENG SHUI PILLAR CANDLE
72349B,SET/6 PURPLE BUTTERFLY T-LIGHTS
72351A,SET/6 TURQUOISE BUTTERFLY T-LIGHTS
72586,SET OF 6 HALLOWEEN GHOST T-LIGHTS
72598,SET/12 TAPER CANDLES
72741,GRAND CHOCOLATECANDLE
72760B,VINTAGE CREAM 3 BASKET CAKE STAND
72799E,IVORY PILLAR CANDLE SILVER FLOCK
72800C,4 PINK DINNER CANDLE SILVER FLOCK
72802A,ROSE SCENT CANDLE IN JEWELLED BOX
72807A,SET/3 ROSE CANDLE IN JEWELLED BOX
72818,CHRISTMAS DECOUPAGE CANDLE
75049L,LARGE CIRCULAR MIRROR MOBILE
79000,MOROCCAN TEA GLASS
79030G,TUMBLER NEW ENGLAND
79051A,SMOKEY GREY COLOUR GLASS
79066K,RETRO MOD TRAY
79164,BLACK WINE GLASS
79321,CHILLI LIGHTS
82482,WOODEN PICTURE FRAME WHITE FINISH
82483,WOOD 2 DRAWER CABINET WHITE FINISH
82484,WOOD BLACK BOARD ANT WHITE FINISH
82486,WOOD S/3 CABINET ANT WHITE FINISH
82494L,WOODEN FRAME ANTIQUE WHITE
82551,LAUNDRY 15C METAL SIGN
82578,KITCHEN METAL SIGN
82580,BATHROOM METAL SIGN
82582,AREA PATROLLED METAL SIGN
82583,HOT BATHS METAL SIGN
82599,FANNY'S REST STOPMETAL SIGN
82600,NO SINGING METAL SIGN
82613B,"METAL SIGN,CUPCAKE SINGLE HOOK"
82613C,"METAL SIGN,CUPCAKE SINGLE HOOK"
82613D,METAL SIGN CUPCAKE SINGLE HOOK
84029E,RED WOOLLY HOTTIE WHITE HEART.
84029G,KNITTED UNION FLAG HOT WATER BOTTLE
84030E,ENGLISH ROSE HOT WATER BOTTLE
84031A,CHARLIE+LOLA RED HOT WATER BOTTLE
84031B,CHARLIE LOLA BLUE HOT WATER BOTTLE
84032A,CHARLIE+LOLA PINK HOT WATER BOTTLE
84050,PINK HEART SHAPE EGG FRYING PAN
84077,WORLD WAR 2 GLIDERS ASSTD DESIGNS
84078A,SET/4 WHITE RETRO STORAGE CUBES
84251G,"GREETING CARD, OVERCROWDED POOL."
84341B,SMALL PINK MAGIC CHRISTMAS TREE
84347,ROTATING SILVER ANGELS T-LIGHT HLDR
84360,TABLE LAMP WHITE SHADE WOOD BASE
84375,SET OF 20 KIDS COOKIE CUTTERS
84378,SET OF 3 HEART COOKIE CUTTERS
84380,SET OF 3 BUTTERFLY COOKIE CUTTERS
84459A,PINK METAL CHICKEN HEART
84459B,YELLOW METAL CHICKEN HEART
84507B,STRIPES DESIGN MONKEY DOLL
84508A,CAMOUFLAGE DESIGN TEDDY
84508B,STRIPES DESIGN TEDDY
84508C,BLUE CIRCLES DESIGN TEDDY
84509B,SET OF 4 FAIRY CAKE PLACEMATS
84510C,SET OF 4 POLKADOT COASTERS
84520B,PACK 20 ENGLISH ROSE PAPER NAPKINS
84527,FLAMES SUNGLASSES PINK LENSES
84535B,FAIRY CAKES NOTEBOOK A6 SIZE
84536A,ENGLISH ROSE NOTEBOOK A7 SIZE
84536B,FAIRY CAKES NOTEBOOK A7 SIZE
84559A,3D SHEET OF DOG STICKERS
84568,GIRLS ALPHABET IRON ON PATCHES
84569D,PACK 6 HEART/ICE-CREAM PATCHES
84596B,SMALL DOLLY MIX DESIGN ORANGE BOWL
84596F,SMALL MARSHMALLOWS PINK BOWL
84596G,SMALL CHOCOLATES PINK BOWL
84596J,MIXED NUTS LIGHT GREEN BOWL
84596L,BISCUITS SMALL BOWL LIGHT BLUE
84598,BOYS ALPHABET IRON ON PATCHES
84625A,PINK NEW BAROQUECANDLESTICK CANDLE
84660B,BLACK STITCHED WALL CLOCK
84661B,BLACK SQUARE TABLE CLOCK
84663A,GRASS HOPPER WOODEN WALL CLOCK
84673B,BLUE FLY SWAT
84674,FLYING PIG WATERING CAN
84685,BEACH HUT KEY CABINET
84692,BOX OF 24 COCKTAIL PARASOLS
84725,FREESTYLE CANVAS ART PICTURE
84731,3 BIRDS CANVAS SCREEN
84754,S/15 SILVER GLASS BAUBLES IN BAG
84755,COLOUR GLASS T-LIGHT HOLDER HANGING
84789,ENCHANTED BIRD PLANT CAGE
84792,ENCHANTED BIRD COATHANGER 5 HOOK
84800S,SMALL WHITE/PINK ROSE ART FLOWER
84803B,WHITE ALLIUM  ARTIFICIAL FLOWER
84818,DANISH ROSE PHOTO FRAME
84819,DANISH ROSE ROUND SEWING BOX
84836,ZINC METAL HEART DECORATION
84843,WHITE SOAP RACK WITH 2 BOTTLES
84849A,HELLO SAILOR BLUE SOAP HOLDER
84857C,PINK MONTE CARLO HANDBAG
84859C,PINK DISCO HANDBAG
84870B,BLUE GEISHA GIRL
84870C,GREEN GEISHA GIRL
84877A,PINK ROUND COMPACT MIRROR
84877B,GREEN ROUND COMPACT MIRROR
84879,ASSORTED COLOUR BIRD ORNAMENT
84884A,ANT WHITE WIRE HEART SPIRAL
84915,HAND TOWEL PINK FLOWER AND DAISY
84924A,WAKE UP COCKEREL CALENDAR SIGN
84926D,LA PALMIERA TILE COASTER
84945,MULTI COLOUR SILVER T-LIGHT HOLDER
84946,ANTIQUE SILVER T-LIGHT GLASS
84947,ANTIQUE SILVER TEA GLASS ENGRAVED
84949,SILVER HANGING T-LIGHT HOLDER
84968A,SET OF 16 VINTAGE ROSE CUTLERY
84968C,SET OF 16 VINTAGE PISTACHIO CUTLERY
84968F,SET OF 16 VINTAGE SKY BLUE CUTLERY
84969,BOX OF 6 ASSORTED COLOUR TEASPOONS
84970L,SINGLE HEART ZINC T-LIGHT HOLDER
84970S,HANGING HEART ZINC T-LIGHT HOLDER
84970l,SINGLE HEART ZINC T-LIGHT HOLDER
84974,S/2 ZINC HEART DESIGN PLANTERS
84978,HANGING HEART JAR T-LIGHT HOLDER
84987,SET OF 36 TEATIME PAPER DOILIES
84988,SET OF 72 PINK HEART PAPER DOILIES
84991,60 TEATIME FAIRY CAKE CASES
84992,72 SWEETHEART FAIRY CAKE CASES
84997A,CHILDRENS CUTLERY POLKADOT GREEN
84997B,CHILDRENS CUTLERY RETROSPOT RED
84997C,BLUE 3 PIECE POLKADOT CUTLERY SET
84997D,CHILDRENS CUTLERY POLKADOT PINK
84997c,CHILDRENS CUTLERY POLKADOT BLUE
84997d,CHILDRENS CUTLERY POLKADOT PINK
85014A,BLACK/BLUE POLKADOT UMBRELLA
85014B,RED RETROSPOT UMBRELLA
85017B,ENVELOPE 50 BLOSSOM IMAGES
85025C,PINK HEART SHAPE PHOTO FRAME
85030,FRENCH CHATEAU OVAL PLATTER
85032A,ROMANTIC IMAGES GIFT WRAP SET
85032D,YULETIDE IMAGES GIFT WRAP SET
85034B,3 WHITE CHOC MORRIS BOXED CANDLES
85036A,GARDENIA 1 WICK MORRIS BOXED CANDLE
85036C,ROSE 1 WICK MORRIS BOXED CANDLE
85039a,SET/4 RED MINI ROSE CANDLE IN BOWL
85040A,S/4 PINK FLOWER CANDLES IN BOWL
85040a,S/4 PINK FLOWER CANDLES IN BOWL
85042,ANTIQUE LILY FAIRY LIGHTS
85049A,TRADITIONAL CHRISTMAS RIBBONS
85049C,ROMANTIC PINKS RIBBONS
85049F,BABY BOOM RIBBONS
85049G,CHOCOLATE BOX RIBBONS
85049a,TRADITIONAL CHRISTMAS RIBBONS
85049e,SCANDINAVIAN REDS RIBBONS
85062,PEARL CRYSTAL PUMPKIN T-LIGHT HLDR
85066,CREAM SWEETHEART MINI CHEST
85078,SCANDINAVIAN 3 HEARTS NAPKIN RING
85086A,CANDY SPOT HEART DECORATION
85093,CANDY SPOT EGG WARMER HARE
85094,CANDY SPOT EGG WARMER RABBIT
85099B,JUMBO BAG RED RETROSPOT
85099C,JUMBO  BAG BAROQUE BLACK WHITE
85099F,JUMBO BAG STRAWBERRY
85114A,BLACK ENCHANTED FOREST PLACEMAT
85116,BLACK CANDELABRA T-LIGHT HOLDER
85123A,WHITE HANGING HEART T-LIGHT HOLDER
85125,SMALL ROUND CUT GLASS CANDLESTICK
85129B,BEADED CRYSTAL HEART GREEN SMALL
85129D,BEADED CRYSTAL HEART PINK SMALL
85130D,BEADED CRYSTAL HEART PINK LARGE
85131A,BEADED PEARL HEART WHITE ON STICK
85131B,BEADED CRYSTAL HEART GREEN ON STICK
85132A,CHARLIE + LOLA BISCUITS TINS
85144,JARDIN ETCHED GLASS CHEESE DISH
85150,LADIES & GENTLEMEN METAL SIGN
85152,HAND OVER THE CHOCOLATE   SIGN
85169C,EAU DE NIL LOVE BIRD CANDLE
85170C,SET/6 EAU DE NIL BIRD T-LIGHTS
85173,SET/6 FROG PRINCE T-LIGHT CANDLES
85174,S/4 CACTI CANDLES
85175,CACTI T-LIGHT CANDLES
85178,VICTORIAN SEWING KIT
85183A,CHARLIE & LOLA WASTEPAPER BIN BLUE
85186C,BUNNY EGG GARLAND
85188A,GREEN METAL SWINGING BUNNY
85194L,HANGING SPRING FLOWER EGG LARGE
85199L,LARGE HANGING IVORY & RED WOOD BIRD
85200,BUNNY EGG BOX
85202,HANGING WOOD AND FELT HEART
85204,HANGING WOOD AND FELT FLOWER
85206A,CREAM FELT EASTER EGG BASKET
85230B,CINNAMON SCENTED VOTIVE CANDLE
85230F,JASMINE VOTIVE CANDLE
85231B,CINAMMON SET OF 9 T-LIGHTS
85232A,SET/3 POLKADOT STACKING TINS
90010E,AMBER GLASS/SILVER BRACELET
90013B,BLACK VINTAGE EARRINGS
90014B,GOLD M PEARL  ORBIT NECKLACE
90022,EDWARDIAN DROP EARRINGS JET BLACK
90030B,RED KUKUI COCONUT SEED NECKLACE
90035C,"PEARL & SHELL 42""NECKL. IVORY"
90094,NECKLACE+BRACELET SET FRUIT SALAD
90123A,PINK HEART OF GLASS BRACELET
90125C,TURQUOISE BERTIE GLASS BEAD CHARM
90161D,ANT COPPER PINK BOUDICCA BRACELET
90164B,WHITE  ROSEBUD PEARL BRACELET
90175A,WHITE GLASS CHUNKY CHARM BRACELET
90185C,BLACK DIAMANTE EXPANDABLE RING
90187B,GREEN DROP EARRINGS W BEAD CLUSTER
90190B,GOLD/AMBER DROP EARRINGS W LEAF
90198A,VINTAGE ROSE BEAD BRACELET RASPBERR
90201B,BLACK ENAMEL FLOWER RING
90208,PAIR OF PINK FLOWER CLUSTER SLIDE
90214C,"LETTER ""C"" BLING KEY RING"
90214S,"LETTER ""S"" BLING KEY RING"
90214W,"LETTER ""W"" BLING KEY RING"
C2,CARRIAGE
DOT,DOTCOM POSTAGE
M,Manual
POST,POSTAGE
