StockCode,Description
10002,INFLATABLE POLITICAL GLOBE
15036,ASSORTED COLOURS SILK FAN
15039,SANDALWOOD FAN
15044A,PINK PAPER PARASOL
15044C,PURPLE PAPER PARASOL
15056BL,EDWARDIAN PARASOL BLACK
15056N,EDWARDIAN PARASOL NATURAL
15056n,EDWARDIAN PARASOL NATURAL
15058A,BLUE POLKADOT GARDEN PARASOL
16011,ANIMAL STICKERS
16014,SMALL CHINESE STYLE SCISSOR
16048,TEATIME ROUND PENCIL SHARPENER
16156S,WRAP PINK FAIRY CAKES
16161P,WRAP ENGLISH ROSE
16169E,WRAP 50'S  CHRISTMAS
16219,HOUSE SHAPE PENCIL SHARPENER
16225,RATTLE SNAKE EGGS
17001,HEAVENS SCENT FRAGRANCE OILS ASSTD
17012B,ORIGAMI JASMINE INCENSE/CANDLE SET
17021,NAMASTE SWAGAT INCENSE
17084A,TRANQUILITY MASALA INCENSE
17084N,FAIRY DREAMS INCENSE
17136A,BLUE STONES ON WIRE FOR CANDLE
20618,QUEEN OF THE SKIES PASSPORT COVER
20652,BLUE POLKADOT LUGGAGE TAG
20654,FIRST CLASS LUGGAGE TAG
20657,TROPICAL LUGGAGE TAG
20667,CHERRY BLOSSOM PURSE
20668,DISCO BALL CHRISTMAS DECORATION
20669,RED HEART LUGGAGE TAG
20675,BLUE POLKADOT BOWL
20676,RED RETROSPOT BOWL
20679,EDWARDIAN PARASOL RED
20682,RED RETROSPOT CHILDRENS UMBRELLA
20685,DOORMAT RED RETROSPOT
20711,JUMBO BAG TOYS
20712,JUMBO BAG WOODLAND ANIMALS
20713,JUMBO BAG OWLS
20717,STRAWBERRY SHOPPER BAG
20718,RED RETROSPOT SHOPPER BAG
20719,WOODLAND CHARLOTTE BAG
20723,STRAWBERRY CHARLOTTE BAG
20724,RED RETROSPOT CHARLOTTE BAG
20725,LUNCH BAG RED RETROSPOT
20726,LUNCH BAG WOODLAND
20728,LUNCH BAG CARS BLUE
20733,GOLD MINI TAPE MEASURE
20749,ASSORTED COLOUR MINI CASES
20751,FUNKY WASHING UP GLOVES ASSORTED
20752,BLUE POLKADOT WASHING UP GLOVES
20754,RETROSPOT RED WASHING UP GLOVES
20756,GREEN FERN POCKET BOOK
20762,GREEN FERN SKETCHBOOK
20769,DAISY JOURNAL
20775,DAISY NOTEBOOK
20828,GLITTER BUTTERFLY CLIPS
20829,GLITTER HANGING BUTTERFLY STRING
20839,FRENCH PAISLEY CUSHION COVER
20846,ZINC HEART LATTICE T-LIGHT HOLDER
20856,DENIM PATCH PURSE PINK BUTTERFLY
20886,BOX OF 9 PEBBLE CANDLES
20914,SET/5 RED RETROSPOT LID GLASS BOWLS
20961,STRAWBERRY BATH SPONGE
20963,APPLE BATH SPONGE
20966,SANDWICH BATH SPONGE
20969,RED FLORAL FELTCRAFT SHOULDER BAG
20970,PINK FLORAL FELTCRAFT SHOULDER BAG
20971,PINK BLUE FELT CRAFT TRINKET BOX
20972,PINK CREAM FELT CRAFT TRINKET BOX
20974,12 PENCILS SMALL TUBE SKULL
20975,12 PENCILS SMALL TUBE RED RETROSPOT
20977,36 PENCILS TUBE WOODLAND
20978,36 PENCILS TUBE SKULLS
20979,36 PENCILS TUBE RED RETROSPOT
20981,12 PENCILS TALL TUBE WOODLAND
20983,12 PENCILS TALL TUBE RED RETROSPOT
20984,12 PENCILS TALL TUBE POSY
20996,JAZZ HEARTS ADDRESS BOOK
20998,ROSE DU SUD OVEN GLOVE
21000,ROSE DU SUD COSMETICS BAG
21026,SPACE OWL
21034,REX CASH+CARRY JUMBO SHOPPER
21035,SET/2 RED RETROSPOT TEA TOWELS
21039,RED RETROSPOT SHOPPING BAG
21056,DOCTOR'S BAG SOFT TOY
21058,PARTY INVITES WOODLAND
21060,PARTY INVITES BALLOON GIRL
21061,PARTY INVITES FOOTBALL
21063,PARTY INVITES JAZZ HEARTS
21068,VINTAGE BILLBOARD LOVE/HATE MUG
21071,VINTAGE BILLBOARD DRINK ME MUG
21078,SET/20 STRAWBERRY PAPER NAPKINS
21080,SET/20 RED RETROSPOT PAPER NAPKINS
21082,SET/20 FRUIT SALAD PAPER NAPKINS
21084,SET/6 COLLAGE PAPER CUPS
21086,SET/6 RED SPOTTY PAPER CUPS
21090,SET/6 COLLAGE PAPER PLATES
21094,SET/6 RED SPOTTY PAPER PLATES
21098,CHRISTMAS TOILET ROLL
21108,FAIRY CAKE FLANNEL ASSORTED COLOUR
21109,LARGE CAKE TOWEL CHOCOLATE SPOTS
21111,"SWISS ROLL TOWEL, CHOCOLATE  SPOTS"
21115,ROSE CARAVAN DOORSTOP
21116,OWL DOORSTOP
21122,SET/10 PINK POLKADOT PARTY CANDLES
21123,SET/10 IVORY POLKADOT PARTY CANDLES
21124,SET/10 BLUE POLKADOT PARTY CANDLES
21128,GOLD FISHING GNOME
21131,GOLD STANDING GNOME
21135,VICTORIAN  METAL POSTCARD SPRING
21136,PAINTED METAL PEARS ASSORTED
21137,BLACK RECORD COVER FRAME
21154,RED RETROSPOT OVEN GLOVE
21155,RED RETROSPOT PEG BAG
21156,RETROSPOT CHILDRENS APRON
21158,MOODY GIRL DOOR HANGER
21164,HOME SWEET HOME METAL SIGN
21165,BEWARE OF THE CAT METAL SIGN
21166,COOK WITH WINE METAL SIGN
21169,YOU'RE CONFUSING ME METAL SIGN
21172,PARTY METAL SIGN
21174,POTTERING IN THE SHED METAL SIGN
21175,GIN + TONIC DIET METAL SIGN
21181,PLEASE ONE PERSON METAL SIGN
21188,3D HEARTS  HONEYCOMB PAPER GARLAND
21189,WHITE HONEYCOMB PAPER GARLAND
21202,DOLLY HONEYCOMB GARLAND
21206,STRAWBERRY HONEYCOMB  GARLAND
21209,MULTICOLOUR HONEYCOMB FAN
21210,SET OF 72 RETROSPOT PAPER  DOILIES
21212,PACK OF 72 RETROSPOT CAKE CASES
21213,PACK OF 72 SKULL CAKE CASES
21215,IVORY PAPER CUP CAKE CASES
21216,"SET 3 RETROSPOT TEA,COFFEE,SUGAR"
21217,RED RETROSPOT ROUND CAKE TINS
21218,RED SPOTTY BISCUIT TIN
21219,SET/4 BADGES BALLOON GIRL
21231,SWEETHEART CERAMIC TRINKET BOX
21232,STRAWBERRY CERAMIC TRINKET BOX
21239,PINK  POLKADOT CUP
21242,RED RETROSPOT PLATE
21244,BLUE POLKADOT PLATE
21245,GREEN POLKADOT PLATE
21246,RED RETROSPOT BIG BOWL
21257,VICTORIAN SEWING BOX MEDIUM
21259,VICTORIAN SEWING BOX SMALL
21260,FIRST AID TIN
21262,WHITE GOOSE FEATHER CHRISTMAS TREE
21264,WHITE GOOSE FEATHER TREE 60CM
21284,RETROSPOT CANDLE  SMALL
21287,SCENTED VELVET LOUNGE CANDLE
21288,STRIPEY CHOCOLATE NESTING BOXES
21306,SET/4 DAISY MIRROR MAGNETS
21311,SET/4 BIRD MIRROR MAGNETS
21313,GLASS HEART T-LIGHT HOLDER
21314,SMALL GLASS HEART TRINKET POT
21317,GLASS SPHERE CANDLE STAND MEDIUM
21320,GLASS CHALICE GREEN  LARGE
21326,AGED GLASS SILVER T-LIGHT HOLDER
21327,SKULLS WRITING SET
21328,BALLOONS  WRITING SET
21329,DINOSAURS  WRITING SET
21348,PINK SPOTS CHOCOLATE NESTING BOXES
21356,TOAST ITS - FAIRY FLOWER
21363,HOME SMALL WOOD LETTERS
21373,MIRRORED WALL ART SNOWFLAKES
21375,LARGE CAMPHOR WOOD FIELD MUSHROOM
21380,WOODEN HAPPY BIRTHDAY GARLAND
21381,MINI WOODEN HAPPY BIRTHDAY GARLAND
21382,SET/4 SPRING FLOWER DECORATION
21383,PACK OF 12 STICKY BUNNIES
21385,IVORY HANGING DECORATION  HEART
21390,FILIGRIS HEART WITH BUTTERFLY
21391,FRENCH LAVENDER SCENT HEART
21394,RED POLKADOT BEAKER
21395,BLUE POLKADOT BEAKER
21397,BLUE POLKADOT EGG CUP
21398,RED POLKADOT COFFEE  MUG
21411,GINGHAM HEART  DOORSTOP RED
21413,PERIWINKLE T-LIGHT HOLDER
21422,PORCELAIN ROSE SMALL
21425,SKULLS STORAGE BOX LARGE
21428,SET3 BOOK BOX GREEN GINGHAM FLOWER
21429,RED GINGHAM ROSE JEWELLERY BOX
21430,SET/3 RED GINGHAM ROSE STORAGE BOX
21439,BASKET OF TOADSTOOLS
21441,BLUE BIRDHOUSE DECORATION
21442,GREEN BIRDHOUSE DECORATION
21446,12 RED ROSE PEG PLACE SETTINGS
21448,12 DAISY PEGS IN WOOD BOX
21452,TOADSTOOL MONEY BOX
21458,2 PICTURE BOOK EGGS EASTER BUNNY
21463,MIRRORED DISCO BALL
21466,RED FLOWER CROCHET FOOD COVER
21469,POLKA DOT RAFFIA FOOD COVER
21470,FLOWER VINE RAFFIA FOOD COVER
21479,WHITE SKULL HOT WATER BOTTLE
21481,FAWN BLUE HOT WATER BOTTLE
21485,RETROSPOT HEART HOT WATER BOTTLE
21494,ROTATING LEAVES T-LIGHT HOLDER
21495,SKULLS AND CROSSBONES WRAP
21497,FANCY FONTS BIRTHDAY WRAP
21498,RED RETROSPOT WRAP
21499,BLUE POLKADOT WRAP
21500,PINK POLKADOT WRAP
21509,COWBOYS AND INDIANS BIRTHDAY CARD
21519,GIN & TONIC DIET GREETING CARD
21523,DOORMAT FANCY FONT HOME SWEET HOME
21524,DOORMAT SPOTTY HOME SWEET HOME
21528,DAIRY MAID TRADITIONAL TEAPOT
21530,DAIRY MAID TOASTRACK
21531,RED RETROSPOT SUGAR JAM BOWL
21533,RETROSPOT LARGE MILK JUG
21534,DAIRY MAID LARGE MILK JUG
21544,SKULLS  WATER TRANSFER TATTOOS
21558,SKULL LUNCH BOX WITH CUTLERY
21559,STRAWBERRY LUNCH BOX WITH CUTLERY
21561,DINOSAUR LUNCH BOX WITH CUTLERY
21563,RED HEART SHAPE LOVE BUCKET
21564,PINK  HEART SHAPE LOVE BUCKET
21576,LETS GO SHOPPING COTTON TOTE BAG
21577,SAVE THE PLANET COTTON TOTE BAG
21592,RETROSPOT CIGAR BOX MATCHES
21595,Dad's Cab Electronic Meter
21616,4 PEAR BOTANICAL DINNER CANDLES
21619,4 VANILLA BOTANICAL CANDLES
21623,VINTAGE UNION JACK MEMOBOARD
21624,VINTAGE UNION JACK DOORSTOP
21630,FLOOR CUSHION ELEPHANT CARNIVAL
21636,MADRAS NOTEBOOK MEDIUM
21641,ASSORTED TUTTI FRUTTI KEYRING BALL
21657,MILK BOTTLE WITH GLASS STOPPER
21668,RED STRIPE CERAMIC DRAWER KNOB
21671,RED SPOT CERAMIC DRAWER KNOB
21672,WHITE SPOT RED CERAMIC DRAWER KNOB
21673,WHITE SPOT BLUE CERAMIC DRAWER KNOB
21700,BIG DOUGHNUT FRIDGE MAGNETS
21703,BAG 125g SWIRLY MARBLES
21704,BAG 250g SWIRLY MARBLES
21710,FOLDING UMBRELLA PINKWHITE POLKADOT
21714,CITRONELLA CANDLE GARDEN POT
21718,RED METAL BEACH SPADE
21723,ALPHABET HEARTS STICKER SHEET
21730,GLASS STAR FROSTED T-LIGHT HOLDER
21731,RED TOADSTOOL LED NIGHT LIGHT
21733,RED HANGING HEART T-LIGHT HOLDER
21744,SNOWFLAKE PORTABLE TABLE LIGHT
21749,LARGE RED RETROSPOT WINDMILL
21750,LARGE SKULL WINDMILL
21754,HOME BUILDING BLOCK WORD
21756,BATH BUILDING BLOCK WORD
21770,OPEN CLOSED METAL SIGN
21774,DECORATIVE CATS BATHROOM BOTTLE
21775,DECORATIVE FLORE BATHROOM BOTTLE
21786,POLKADOT RAIN HAT
21787,RAIN PONCHO RETROSPOT
21789,KIDS RAIN MAC PINK
21790,VINTAGE SNAP CARDS
21791,VINTAGE HEADS AND TAILS CARD GAME
21793,CLASSIC FRENCH STYLE BASKET BROWN
21794,CLASSIC FRENCH STYLE BASKET NATURAL
21801,CHRISTMAS TREE DECORATION WITH BELL
21803,CHRISTMAS TREE STAR DECORATION
21808,"CHRISTMAS GARLAND STARS,TREES"
21809,CHRISTMAS HANGING TREE WITH BELL
21810,CHRISTMAS HANGING STAR WITH BELL
21811,HANGING HEART WITH BELL
21819,GLITTER CHRISTMAS STAR
21829,DINOSAUR KEYRINGS ASSORTED
21830,ASSORTED CREEPY CRAWLIES
21843,RED RETROSPOT CAKE STAND
21844,RED RETROSPOT MUG
21845,DAIRY MAID STRIPE MUG
21846,PINK DIAMANTE PEN IN GIFT BOX
21849,SILVER DIAMANTE PEN IN GIFT BOX
21850,BLUE  DIAMANTE PEN IN GIFT BOX
21851,LILAC DIAMANTE PEN IN GIFT BOX
21865,PINK UNION JACK  PASSPORT COVER
21868,POTTING SHED TEA MUG
21870,I CAN ONLY PLEASE ONE PERSON MUG
21871,SAVE THE PLANET MUG
21874,GIN AND TONIC MUG
21876,POTTERING MUG
21877,HOME SWEET HOME MUG
21878,PACK OF 6 SANDCASTLE FLAGS ASSORTED
21880,RED RETROSPOT TAPE
21883,STARS GIFT TAPE
21888,BINGO SET
21889,WOODEN BOX OF DOMINOES
21890,S/6 WOODEN SKITTLES IN COTTON BAG
21891,TRADITIONAL WOODEN SKIPPING ROPE
21892,TRADITIONAL WOODEN CATCH CUP GAME
21896,POTTING SHED TWINE
21898,POTTING SHED ROSE CANDLE
21899,GARAGE KEY FOB
21900,"KEY FOB , SHED"
21901,"KEY FOB , BACK DOOR"
21905,MORE BUTTER METAL SIGN
21908,CHOCOLATE THIS WAY METAL SIGN
21912,VINTAGE SNAKES & LADDERS
21913,VINTAGE SEASIDE JIGSAW PUZZLES
21914,BLUE HARMONICA IN BOX
21916,SET 12 RETRO WHITE CHALK STICKS
21917,SET 12 KIDS  WHITE CHALK STICKS
21918,SET 12 KIDS COLOUR  CHALK STICKS
21922,UNION STRIPE WITH FRINGE  HAMMOCK
21927,BLUE/CREAM STRIPE CUSHION COVER
21928,JUMBO BAG SCANDINAVIAN BLUE PAISLEY
21929,JUMBO BAG PINK VINTAGE PAISLEY
21930,JUMBO STORAGE BAG SKULLS
21931,JUMBO STORAGE BAG SUKI
21932,SCANDINAVIAN PAISLEY PICNIC BAG
21933,PINK VINTAGE PAISLEY PICNIC BAG
21934,SKULL SHOULDER BAG
21936,RED RETROSPOT PICNIC BAG
21944,KITTENS DESIGN FLANNEL
21945,STRAWBERRIES  DESIGN FLANNEL
21948,SET OF 6 CAKE CHOPSTICKS
21975,PACK OF 60 DINOSAUR CAKE CASES
21976,PACK OF 60 MUSHROOM CAKE CASES
21977,PACK OF 60 PINK PAISLEY CAKE CASES
21980,PACK OF 12 RED RETROSPOT TISSUES
21982,PACK OF 12 SUKI TISSUES
21985,PACK OF 12 HEARTS DESIGN TISSUES
21986,PACK OF 12 PINK POLKADOT TISSUES
21987,PACK OF 6 SKULL PAPER CUPS
21989,PACK OF 20 SKULL PAPER NAPKINS
21990,MODERN FLORAL STATIONERY SET
21991,BOHEMIAN COLLAGE STATIONERY SET
21993,FLORAL FOLK STATIONERY SET
22024,RAINY LADIES BIRTHDAY CARD
22028,PENNY FARTHING BIRTHDAY CARD
22029,SPACEBOY BIRTHDAY CARD
22030,SWALLOWS GREETING CARD
22031,BOTANICAL LAVENDER BIRTHDAY CARD
22032,BOTANICAL LILY GREETING CARD
22037,ROBOT BIRTHDAY CARD
22041,"RECORD FRAME 7"" SINGLE SIZE"
22046,TEA PARTY  WRAPPING PAPER
22047,EMPIRE GIFT WRAP
22055,MINI CAKE STAND  HANGING STRAWBERY
22059,CERAMIC STRAWBERRY DESIGN MUG
22060,LARGE CAKE STAND HANGING HEARTS
22061,LARGE CAKE STAND  HANGING STRAWBERY
22065,CHRISTMAS PUDDING TRINKET POT
22066,LOVE HEART TRINKET POT
22067,CHOC TRUFFLE GOLD TRINKET POT
22070,SMALL RED RETROSPOT MUG IN BOX
22071,SMALL WHITE RETROSPOT MUG IN BOX
22072,RED RETROSPOT TEA CUP AND SAUCER
22074,6 RIBBONS SHIMMERING PINKS
22076,6 RIBBONS EMPIRE
22077,6 RIBBONS RUSTIC CHARM
22079,RIBBON REEL HEARTS DESIGN
22080,RIBBON REEL POLKADOTS
22081,RIBBON REEL FLORA + FAUNA
22082,RIBBON REEL STRIPES DESIGN
22083,PAPER CHAIN KIT RETROSPOT
22085,PAPER CHAIN KIT SKULLS
22086,PAPER CHAIN KIT 50'S CHRISTMAS
22087,PAPER BUNTING WHITE LACE
22089,PAPER BUNTING VINTAGE PAISLEY
22090,PAPER BUNTING RETROSPOT
22094,RED RETROSPOT TISSUE BOX
22096,PINK PAISLEY SQUARE TISSUE BOX
22097,SWALLOW SQUARE TISSUE BOX
22098,BOUDOIR SQUARE TISSUE BOX
22099,CARAVAN SQUARE TISSUE BOX
22107,PIZZA PLATE IN BOX
22109,FULL ENGLISH BREAKFAST PLATE
22110,BIRD HOUSE HOT WATER BOTTLE
22111,SCOTTIE DOG HOT WATER BOTTLE
22112,CHOCOLATE HOT WATER BOTTLE
22113,GREY HEART HOT WATER BOTTLE
22114,HOT WATER BOTTLE TEA AND SYMPATHY
22115,METAL SIGN EMPIRE TEA
22117,METAL SIGN HER DINNER IS SERVED
22119,PEACE WOODEN BLOCK LETTERS
22120,WELCOME  WOODEN BLOCK LETTERS
22123,PING MICROWAVE APRON
22132,RED LOVE HEART SHAPE CUP
22133,PINK LOVE HEART SHAPE CUP
22135,MINI LADLE LOVE HEART PINK
22136,LOVE HEART SOCK HANGER
22138,BAKING SET 9 PIECE RETROSPOT
22139,RETROSPOT TEA SET CERAMIC 11 PC
22141,CHRISTMAS CRAFT TREE TOP ANGEL
22142,CHRISTMAS CRAFT WHITE FAIRY
22144,CHRISTMAS CRAFT LITTLE FRIENDS
22147,FELTCRAFT BUTTERFLY HEARTS
22149,FELTCRAFT 6 FLOWER FRIENDS
22151,PLACE SETTING WHITE HEART
22152,PLACE SETTING WHITE STAR
22153,ANGEL DECORATION STARS ON DRESS
22154,ANGEL DECORATION 3 BUTTONS
22155,STAR DECORATION RUSTIC
22156,HEART DECORATION WITH PEARLS
22158,3 HEARTS HANGING DECORATION RUSTIC
22161,HEART DECORATION RUSTIC HANGING
22162,HEART GARLAND RUSTIC PADDED
22163,HEART STRING MEMO HOLDER HANGING
22166,WALL MIRROR RECTANGLE DIAMANTE PINK
22169,FAMILY ALBUM WHITE PICTURE FRAME
22171,3 HOOK PHOTO SHELF ANTIQUE WHITE
22173,METAL 4 HOOK HANGER FRENCH CHATEAU
22174,PHOTO CUBE
22175,PINK OWL SOFT TOY
22178,VICTORIAN GLASS HANGING T-LIGHT
22179,SET 10 LIGHTS NIGHT OWL
22180,RETROSPOT LAMP
22187,GREEN CHRISTMAS TREE CARD HOLDER
22189,CREAM HEART CARD HOLDER
22192,BLUE DINER WALL CLOCK
22194,BLACK DINER WALL CLOCK
22195,LARGE HEART MEASURING SPOONS
22196,SMALL HEART MEASURING SPOONS
22197,POPCORN HOLDER
22199,FRYING PAN RED RETROSPOT
22203,MILK PAN RED RETROSPOT
22208,WOOD STAMP SET THANK YOU
22209,WOOD STAMP SET HAPPY BIRTHDAY
22212,FOUR HOOK  WHITE LOVEBIRDS
22215,CAKE STAND WHITE TWO TIER LACE
22217,T-LIGHT HOLDER HANGING LACE
22219,LOVEBIRD HANGING DECORATION WHITE
22227,HANGING HEART MIRROR DECORATION
22231,JIGSAW TREE WITH BIRDHOUSE
22244,3 HOOK HANGER MAGIC GARDEN
22248,DECORATION  PINK CHICK MAGIC GARDEN
22251,BIRDHOUSE DECORATION MAGIC GARDEN
22255,FELT TOADSTOOL  SMALL
22258,FELT FARM ANIMAL RABBIT
22261,FELT EGG COSY WHITE RABBIT
22262,FELT EGG COSY CHICKEN
22263,FELT EGG COSY LADYBIRD
22268,DECORATION SITTING BUNNY
22271,FELTCRAFT DOLL ROSIE
22274,FELTCRAFT DOLL EMILY
22277,COSMETIC BAG VINTAGE ROSE PAISLEY
22281,EASTER TREE YELLOW BIRDS
22283,6 EGG HOUSE PAINTED WOOD
22284,HEN HOUSE DECORATION
22285,HANGING HEN ON NEST DECORATION
22286,DECORATION WOBBLY RABBIT METAL
22291,HANGING CHICK CREAM DECORATION
22292,HANGING CHICK  YELLOW DECORATION
22294,HEART FILIGREE DOVE  SMALL
22295,HEART FILIGREE DOVE LARGE
22296,HEART IVORY TRELLIS LARGE
22297,HEART IVORY TRELLIS SMALL
22300,COFFEE MUG DOG + BALL DESIGN
22301,COFFEE MUG CAT + BIRD DESIGN
22302,COFFEE MUG PEARS  DESIGN
22303,COFFEE MUG APPLES DESIGN
22310,IVORY KNITTED MUG COSY
22311,OFFICE MUG WARMER BLACK+SILVER
22312,OFFICE MUG WARMER POLKADOT
22315,200 RED + WHITE BENDY STRAWS
22317,FIVE CATS HANGING DECORATION
22318,FIVE HEART HANGING DECORATION
22319,HAIRCLIPS FORTIES FABRIC ASSORTED
22320,BIRDS MOBILE VINTAGE DESIGN
22321,BIRD DECORATION RED RETROSPOT
22325,MOBILE VINTAGE HEARTS
22326,ROUND SNACK BOXES SET OF4 WOODLAND
22327,ROUND SNACK BOXES SET OF 4 SKULLS
22328,ROUND SNACK BOXES SET OF 4 FRUITS
22329,ROUND CONTAINER SET OF 5 RETROSPOT
22333,RETROSPOT PARTY BAG + STICKER SET
22335,HEART DECORATION PAINTED ZINC
22336,DOVE DECORATION PAINTED ZINC
22338,STAR DECORATION PAINTED ZINC
22339,CHRISTMAS TREE PAINTED ZINC
22348,TEA BAG PLATE RED RETROSPOT
22352,LUNCH BOX WITH CUTLERY RETROSPOT
22353,LUNCH BOX WITH CUTLERY FAIRY CAKES
22354,RETROSPOT PADDED SEAT CUSHION
22355,CHARLOTTE BAG SUKI DESIGN
22356,CHARLOTTE BAG PINK POLKADOT
22357,KINGS CHOICE BISCUIT TIN
22358,KINGS CHOICE TEA CADDY
22364,GLASS JAR DIGESTIVE BISCUITS
22365,DOORMAT RESPECTABLE HOUSE
22366,DOORMAT AIRMAIL
22367,CHILDRENS APRON SPACEBOY DESIGN
22371,AIRLINE BAG VINTAGE TOKYO 78
22375,AIRLINE BAG VINTAGE JET SET BROWN
22377,BOTTLE BAG RETROSPOT
22378,WALL TIDY RETROSPOT
22379,RECYCLING BAG RETROSPOT
22380,TOY TIDY SPACEBOY
22381,TOY TIDY PINK POLKADOT
22382,LUNCH BAG SPACEBOY DESIGN
22383,LUNCH BAG SUKI DESIGN
22384,LUNCH BAG PINK POLKADOT
22385,JUMBO BAG SPACEBOY DESIGN
22386,JUMBO BAG PINK POLKADOT
22398,MAGNETS PACK OF 4 SWALLOWS
22399,MAGNETS PACK OF 4 CHILDHOOD MEMORY
22411,JUMBO SHOPPER VINTAGE RED PAISLEY
22412,METAL SIGN NEIGHBOURHOOD WITCH
22413,METAL SIGN TAKE IT OR LEAVE IT
22416,SET OF 36 SPACEBOY PAPER DOILIES
22417,PACK OF 60 SPACEBOY CAKE CASES
22418,10 COLOUR SPACEBOY PEN
22420,LIPSTICK PEN BABY PINK
22421,LIPSTICK PEN FUSCHIA
22423,REGENCY CAKESTAND 3 TIER
22424,ENAMEL BREAD BIN CREAM
22427,ENAMEL FLOWER JUG CREAM
22428,ENAMEL FIRE BUCKET CREAM
22429,ENAMEL MEASURING JUG CREAM
22430,ENAMEL WATERING CAN CREAM
22431,WATERING CAN BLUE ELEPHANT
22432,WATERING CAN PINK BUNNY
22433,WATERING CAN GREEN DINOSAUR
22435,SET OF 9 HEART SHAPED BALLOONS
22436,12 COLOURED PARTY BALLOONS
22437,SET OF 9 BLACK SKULL BALLOONS
22438,BALLOON ART MAKE YOUR OWN FLOWERS
22439,6 ROCKET BALLOONS
22442,GROW YOUR OWN FLOWERS SET OF 3
22443,GROW YOUR OWN HERBS SET OF 3
22445,PENCIL CASE LIFE IS BEAUTIFUL
22446,PIN CUSHION BABUSHKA PINK
22451,SILK PURSE BABUSHKA RED
22457,NATURAL SLATE HEART CHALKBOARD
22460,EMBOSSED GLASS TEALIGHT HOLDER
22464,HANGING METAL HEART LANTERN
22465,HANGING METAL STAR LANTERN
22466,FAIRY TALE COTTAGE NIGHTLIGHT
22467,GUMBALL COAT RACK
22468,BABUSHKA LIGHTS STRING OF 10
22469,HEART OF WICKER SMALL
22470,HEART OF WICKER LARGE
22471,TV DINNER TRAY AIR HOSTESS
22477,WATERING CAN GARDEN MARKER
22478,BIRDHOUSE GARDEN MARKER
22481,BLACK TEA TOWEL CLASSIC DESIGN
22485,SET OF 2 WOODEN MARKET CRATES
22488,NATURAL SLATE RECTANGLE CHALKBOARD
22489,PACK OF 12 TRADITIONAL CRAYONS
22492,MINI PAINT SET VINTAGE
22493,PAINT YOUR OWN CANVAS SET
22494,EMERGENCY FIRST AID TIN
22497,SET OF 2 TINS VINTAGE BATHROOM
22499,WOODEN UNION JACK BUNTING
22500,SET OF 2 TINS JARDIN DE PROVENCE
22501,PICNIC BASKET WICKER LARGE
22502,PICNIC BASKET WICKER SMALL
22505,MEMO BOARD COTTAGE DESIGN
22507,MEMO BOARD RETROSPOT  DESIGN
22508,DOORSTOP RETROSPOT HEART
22513,DOORSTOP FOOTBALL DESIGN
22514,CHILDS GARDEN SPADE BLUE
22517,CHILDS GARDEN RAKE PINK
22519,CHILDS GARDEN BRUSH PINK
22520,CHILDS GARDEN TROWEL BLUE
22521,CHILDS GARDEN TROWEL PINK
22523,CHILDS GARDEN FORK PINK
22529,MAGIC DRAWING SLATE GO TO THE FAIR
22530,MAGIC DRAWING SLATE DOLLY GIRL
22531,MAGIC DRAWING SLATE CIRCUS PARADE
22533,MAGIC DRAWING SLATE BAKE A CAKE
22536,MAGIC DRAWING SLATE PURDEY
22539,MINI JIGSAW DOLLY GIRL
22540,MINI JIGSAW CIRCUS PARADE
22541,MINI JIGSAW LEAP FROG
22543,MINI JIGSAW BAKE A CAKE
22544,MINI JIGSAW SPACEBOY
22545,MINI JIGSAW BUNNIES
22546,MINI JIGSAW PURDEY
22549,PICTURE DOMINOES
22551,PLASTERS IN TIN SPACEBOY
22553,PLASTERS IN TIN SKULLS
22554,PLASTERS IN TIN WOODLAND ANIMALS
22555,PLASTERS IN TIN STRONGMAN
22556,PLASTERS IN TIN CIRCUS PARADE
22557,PLASTERS IN TIN VINTAGE PAISLEY
22558,CLOTHES PEGS RETROSPOT PACK 24
22559,SEASIDE FLYING DISC
22560,TRADITIONAL MODELLING CLAY
22561,WOODEN SCHOOL COLOURING SET
22562,MONSTERS STENCIL CRAFT
22565,FELTCRAFT HAIRBANDS PINK AND WHITE
22567,20 DOLLY PEGS RETROSPOT
22568,FELTCRAFT CUSHION OWL
22570,FELTCRAFT CUSHION RABBIT
22573,STAR WOODEN CHRISTMAS DECORATION
22576,SWALLOW WOODEN CHRISTMAS DECORATION
22577,WOODEN HEART CHRISTMAS SCANDINAVIAN
22578,WOODEN STAR CHRISTMAS SCANDINAVIAN
22579,WOODEN TREE CHRISTMAS SCANDINAVIAN
22580,ADVENT CALENDAR GINGHAM SACK
22584,PACK OF 6 PANNETONE GIFT BOXES
22585,PACK OF 6 BIRDY GIFT TAGS
22586,FELTCRAFT HAIRBAND PINK AND BLUE
22589,CARDHOLDER GINGHAM STAR
22591,CARDHOLDER GINGHAM CHRISTMAS TREE
22592,CARDHOLDER HOLLY WREATH METAL
22595,GINGHAM HEART DECORATION
22596,CHRISTMAS STAR WISH LIST CHALKBOARD
22598,CHRISTMAS MUSICAL ZINC TREE
22600,CHRISTMAS RETROSPOT STAR WOOD
22602,CHRISTMAS RETROSPOT HEART WOOD
22607,WOODEN ROUNDERS GARDEN SET
22608,PENS ASSORTED FUNKY JEWELED
22610,PENS ASSORTED FUNNY FACE
22613,PACK OF 20 SPACEBOY NAPKINS
22614,PACK OF 12 SPACEBOY TISSUES
22616,PACK OF 12 LONDON TISSUES
22617,BAKING SET SPACEBOY DESIGN
22619,SET OF 6 SOLDIER SKITTLES
22620,4 TRADITIONAL SPINNING TOPS
22621,TRADITIONAL KNITTING NANCY
22622,BOX OF VINTAGE ALPHABET BLOCKS
22624,IVORY KITCHEN SCALES
22625,RED KITCHEN SCALES
22626,BLACK KITCHEN SCALES
22627,MINT KITCHEN SCALES
22629,SPACEBOY LUNCH BOX
22630,DOLLY GIRL LUNCH BOX
22631,CIRCUS PARADE LUNCH BOX
22633,HAND WARMER UNION JACK
22634,CHILDS BREAKFAST SET SPACEBOY
22635,CHILDS BREAKFAST SET DOLLY GIRL
22637,PIGGY BANK RETROSPOT
22640,SET OF 4 NAPKIN CHARMS 3 KEYS
22644,CERAMIC CHERRY CAKE MONEY BANK
22646,CERAMIC STRAWBERRY CAKE MONEY BANK
22649,STRAWBERRY FAIRY CAKE TEAPOT
22650,CERAMIC PIRATE CHEST MONEY BANK
22652,TRAVEL SEWING KIT
22654,DELUXE SEWING KIT
22659,LUNCH BOX I LOVE LONDON
22662,LUNCH BAG DOLLY GIRL DESIGN
22665,RECIPE BOX BLUE SKETCHBOOK DESIGN
22666,RECIPE BOX PANTRY YELLOW DESIGN
22667,RECIPE BOX RETROSPOT
22668,PINK BABY BUNTING
22669,RED BABY BUNTING
22670,FRENCH WC SIGN BLUE METAL
22671,FRENCH LAUNDRY SIGN BLUE METAL
22672,FRENCH BATHROOM SIGN BLUE METAL
22673,FRENCH GARDEN SIGN BLUE METAL
22674,FRENCH TOILET SIGN BLUE METAL
22675,FRENCH KITCHEN SIGN BLUE METAL
22679,FRENCH BLUE METAL DOOR SIGN 4
22680,FRENCH BLUE METAL DOOR SIGN 5
22686,FRENCH BLUE METAL DOOR SIGN No
22692,DOORMAT WELCOME TO OUR HOME
22693,GROW A FLYTRAP OR SUNFLOWER IN TIN
22694,WICKER STAR
22696,WICKER WREATH LARGE
22697,GREEN REGENCY TEACUP AND SAUCER
22698,PINK REGENCY TEACUP AND SAUCER
22699,ROSES REGENCY TEACUP AND SAUCER
22701,PINK DOG BOWL
22705,WRAP GREEN PEARS
22709,WRAP WEDDING DAY
22710,WRAP I LOVE LONDON
22714,CARD BIRTHDAY COWBOY
22716,CARD CIRCUS PARADE
22718,CARD CAT AND TREE
22719,GUMBALL MONOCHROME COAT RACK
22720,SET OF 3 CAKE TINS PANTRY DESIGN
22721,SET OF 3 CAKE TINS SKETCHBOOK
22722,SET OF 6 SPICE TINS PANTRY DESIGN
22725,ALARM CLOCK BAKELIKE CHOCOLATE
22726,ALARM CLOCK BAKELIKE GREEN
22727,ALARM CLOCK BAKELIKE RED
22728,ALARM CLOCK BAKELIKE PINK
22729,ALARM CLOCK BAKELIKE ORANGE
22730,ALARM CLOCK BAKELIKE IVORY
22731,3D CHRISTMAS STAMPS STICKERS
22732,3D VINTAGE CHRISTMAS STICKERS
22733,3D TRADITIONAL CHRISTMAS STICKERS
22734,SET OF 6 RIBBONS VINTAGE CHRISTMAS
22735,RIBBON REEL SOCKS AND MITTENS
22738,RIBBON REEL SNOWY VILLAGE
22740,POLKADOT PEN
22741,FUNKY DIVA PEN
22743,MAKE YOUR OWN FLOWERPOWER CARD KIT
22745,POPPY'S PLAYHOUSE BEDROOM
22748,POPPY'S PLAYHOUSE KITCHEN
22749,FELTCRAFT PRINCESS CHARLOTTE DOLL
22750,FELTCRAFT PRINCESS LOLA DOLL
22751,FELTCRAFT PRINCESS OLIVIA DOLL
22753,SMALL YELLOW BABUSHKA NOTEBOOK
22754,SMALL RED BABUSHKA NOTEBOOK
22755,SMALL PURPLE BABUSHKA NOTEBOOK
22757,LARGE RED BABUSHKA NOTEBOOK
22759,SET OF 3 NOTEBOOKS IN PARCEL
22761,CHEST 7 DRAWER MA CAMPAGNE
22763,KEY CABINET MA CAMPAGNE
22766,PHOTO FRAME CORNICE
22767,TRIPLE PHOTO FRAME CORNICE
22768,FAMILY PHOTO FRAME CORNICE
22770,MIRROR CORNICE
22771,CLEAR DRAWER KNOB ACRYLIC EDWARDIAN
22773,GREEN DRAWER KNOB ACRYLIC EDWARDIAN
22775,PURPLE DRAWERKNOB ACRYLIC EDWARDIAN
22776,SWEETHEART 3 TIER CAKE STAND
22778,GLASS CLOCHE SMALL
22781,GUMBALL MAGAZINE RACK
22784,LANTERN CREAM GAZEBO
22789,T-LIGHT HOLDER SWEETHEART HANGING
22791,T-LIGHT GLASS FLUTED ANTIQUE
22796,PHOTO FRAME 3 CLASSIC HANGING
22797,CHEST OF DRAWERS GINGHAM HEART
22798,ANTIQUE GLASS DRESSING TABLE POT
22799,SWEETHEART WIRE FRUIT BOWL
22804,CANDLEHOLDER PINK HANGING HEART
22805,BLUE DRAWER KNOB ACRYLIC EDWARDIAN
22807,SET OF 6 T-LIGHTS TOADSTOOLS
22811,SET OF 6 T-LIGHTS CACTI
22812,PACK 3 BOXES CHRISTMAS PANETTONE
22813,PACK 3 BOXES BIRD PANNETONE
22815,CARD PSYCHEDELIC APPLES
22817,CARD SUKI BIRTHDAY
22818,CARD CHRISTMAS VILLAGE
22819,"BIRTHDAY CARD, RETRO SPOT"
22821,GIFT BAG PSYCHEDELIC APPLES
22829,SWEETHEART WIRE WALL TIDY
22834,HAND WARMER BABUSHKA DESIGN
22835,HOT WATER BOTTLE I AM SO POORLY
22837,HOT WATER BOTTLE BABUSHKA
22838,3 TIER CAKE TIN RED AND CREAM
22840,ROUND CAKE TIN VINTAGE RED
22842,BISCUIT TIN VINTAGE RED
22844,VINTAGE CREAM DOG FOOD CONTAINER
22845,VINTAGE CREAM CAT FOOD CONTAINER
22846,BREAD BIN DINER STYLE RED
22847,BREAD BIN DINER STYLE IVORY
22848,BREAD BIN DINER STYLE PINK
22849,BREAD BIN DINER STYLE MINT
22851,SET 20 NAPKINS FAIRY CAKES DESIGN
22855,FINE WICKER HEART
22856,ASSORTED EASTER DECORATIONS  BELLS
22858,EASTER TIN KEEPSAKE
22861,EASTER TIN CHICKS IN GARDEN
22863,SOAP DISH BROCANTE
22865,HAND WARMER OWL DESIGN
22866,HAND WARMER SCOTTY DOG DESIGN
22867,HAND WARMER BIRD DESIGN
22869,NUMBER TILE COTTAGE GARDEN 1
22873,NUMBER TILE COTTAGE GARDEN 5
22890,NOVELTY BISCUITS CAKE STAND 3 TIER
22891,TEA FOR ONE POLKADOT
22892,SET OF SALT AND PEPPER TOADSTOOLS
22893,MINI CAKE STAND T-LIGHT HOLDER
22894,TABLECLOTH RED APPLES DESIGN
22895,SET OF 2 TEA TOWELS APPLE AND PEARS
22896,PEG BAG APPLES DESIGN
22898,CHILDRENS APRON APPLES DESIGN
22899,CHILDREN'S APRON DOLLY GIRL
22900,SET 2 TEA TOWELS I LOVE LONDON
22904,CALENDAR PAPER CUT DESIGN
22906,12 MESSAGE CARDS WITH ENVELOPES
22907,PACK OF 20 NAPKINS PANTRY DESIGN
22908,PACK OF 20 NAPKINS RED APPLES
22909,SET OF 20 VINTAGE CHRISTMAS NAPKINS
22910,PAPER CHAIN KIT VINTAGE CHRISTMAS
22913,RED COAT RACK PARIS FASHION
22914,BLUE COAT RACK PARIS FASHION
22915,ASSORTED BOTTLE TOP  MAGNETS
22921,HERB MARKER CHIVES
22923,FRIDGE MAGNETS LES ENFANTS ASSORTED
22925,BLUE GIANT GARDEN THERMOMETER
22926,IVORY GIANT GARDEN THERMOMETER
22927,GREEN GIANT GARDEN THERMOMETER
22929,SCHOOL DESK AND CHAIR
22930,BAKING MOULD HEART MILK CHOCOLATE
22933,BAKING MOULD EASTER EGG MILK CHOC
22934,BAKING MOULD EASTER EGG WHITE CHOC
22935,BAKING MOULD ROSE MILK CHOCOLATE
22937,BAKING MOULD CHOCOLATE CUPCAKES
22939,ADULT APRON APPLE DELIGHT
22940,FELTCRAFT CHRISTMAS FAIRY
